{
  "asset": "ETH-USDT",
  "timeframe": "1h",
  "generated_at_ms": 1700000000000,
  "expected_venues": [
    "binance",
    "okx",
    "bybit"
  ],
  "bars_by_market_type": {
    "spot_usdt": [
      {
        "asset": "ETH-USDT",
        "timeframe": "1h",
        "market_type": "spot_usdt",
        "timestamp_ms": 1699989200000,
        "open": 48.8064,
        "high": 49.5008,
        "low": 48.608,
        "close": 49.2032,
        "median_close": 49.2032,
        "vwap_close": 49.2032,
        "volume_base_total": 176.8,
        "volume_quote_total": 8699.12576,
        "venue_count": 3,
        "venue_weights": {
          "binance": 0.34,
          "okx": 0.33,
          "bybit": 0.33
        },
        "coverage": 1,
        "price_dispersion_pct": 0.11,
        "data_quality": 0.87
      },
      {
        "asset": "ETH-USDT",
        "timeframe": "1h",
        "market_type": "spot_usdt",
        "timestamp_ms": 1699992800000,
        "open": 49.2032,
        "high": 49.7984,
        "low": 49.0048,
        "close": 49.5008,
        "median_close": 49.5008,
        "vwap_close": 49.5008,
        "volume_base_total": 187.0,
        "volume_quote_total": 9256.6496,
        "venue_count": 3,
        "venue_weights": {
          "binance": 0.34,
          "okx": 0.33,
          "bybit": 0.33
        },
        "coverage": 1,
        "price_dispersion_pct": 0.1,
        "data_quality": 0.88
      },
      {
        "asset": "ETH-USDT",
        "timeframe": "1h",
        "market_type": "spot_usdt",
        "timestamp_ms": 1699996400000,
        "open": 49.5008,
        "high": 50.1952,
        "low": 49.3024,
        "close": 49.7984,
        "median_close": 49.7984,
        "vwap_close": 49.7984,
        "volume_base_total": 197.2,
        "volume_quote_total": 9820.24448,
        "venue_count": 3,
        "venue_weights": {
          "binance": 0.34,
          "okx": 0.33,
          "bybit": 0.33
        },
        "coverage": 1,
        "price_dispersion_pct": 0.09,
        "data_quality": 0.89
      },
      {
        "asset": "ETH-USDT",
        "timeframe": "1h",
        "market_type": "spot_usdt",
        "timestamp_ms": 1700000000000,
        "open": 49.6,
        "high": 50.592,
        "low": 48.608,
        "close": 50.096,
        "median_close": 50.096,
        "vwap_close": 50.096,
        "volume_base_total": 204.0,
        "volume_quote_total": 10219.584,
        "venue_count": 3,
        "venue_weights": {
          "binance": 0.34,
          "okx": 0.33,
          "bybit": 0.33
        },
        "coverage": 1,
        "price_dispersion_pct": 0.08,
        "data_quality": 0.9
      }
    ]
  },
  "latest_by_market_type": {
    "spot_usdt": {
      "asset": "ETH-USDT",
      "timeframe": "1h",
      "market_type": "spot_usdt",
      "timestamp_ms": 1700000000000,
      "open": 49.6,
      "high": 50.592,
      "low": 48.608,
      "close": 50.096,
      "median_close": 50.096,
      "vwap_close": 50.096,
      "volume_base_total": 204.0,
      "volume_quote_total": 10219.584,
      "venue_count": 3,
      "venue_weights": {
        "binance": 0.34,
        "okx": 0.33,
        "bybit": 0.33
      },
      "coverage": 1,
      "price_dispersion_pct": 0.08,
      "data_quality": 0.88
    }
  },
  "status_by_market_type": {
    "spot_usdt": "COMPOSITE_DATA_OK"
  },
  "coverage_by_market_type": {
    "spot_usdt": 1
  },
  "notes": [
    "Illustrative synthetic sample; not live market data.",
    "Synthetic 1h fixture for dashboard multi-timeframe onboarding."
  ]
}
